id,title,company,location,tags,qualifications,preferred,benefits,skills,workplace
102299,[글로벌 OTT 서비스] Video Software Engineer,오디케이미디어 (OnDemandKorea),"['서울', '한국']","['퇴사율5%이하', '50명이하', '설립3년이하', '식비', '커피', '연봉상위11~20%', 'IT, 컨텐츠']","['• 3년 이상의 실무 경험을 보유하신 분 ( junior/senior engineer 채용 )', '• REST API 서버 개발에 필요한 지식 및 경험을 보유하신 분', '• SQL (PostgreSQL, MySQL, etc.) 사용 경험이 있으신 분', '• CSS/HTML/Typescript(or Javascript) 개발 가능하신 분', '• 디지털 미디어에 대한 기본 지식(미디어 컨테이너, 코덱 등)을 보유하신 분']","['• Python, 웹 서버 기반 프레임워크에 대한 깊은 이해 및 구현이 가능하신 분', '• FFmpeg 혹은 libav를 이용한 영상 변환 경험을 보유하신 분', '• 대용량 파일을 관리할 때 필요한 지식 또는 경험(업로드, 다운로드, 실패 방지 등)을 보유하신 분', '• AWS 클라우드 서비스 중 AWS S3, Batch에 다양한 경험 및 지식을 보유하신 분', '• 영상의 품질을 높이는데 필요한 기본적인 지식(VMAF, PSNR, 등)을 보유하신 분', '• 영어로 커뮤니케이션 하는데 어려움이 없는 분']","['• 무제한 휴가 (실제 적게는 20일에서 많게는 40일 사용)', '• 자율 출퇴근', '• 팀 문화: 코드리뷰, 공부하고 싶은 것 스터디, 협업과 학습을 중시하는 문화', '• 글로벌 회사: 미국 오피스(Fullerton, CA) 출장 기회, 글로벌 서비스를 만들 수 있는 환경', '• 점심 1.2만원, 저녁 2만원(야근시) 식비 지원(연 500만원 상당)', '• AWS 개인 계정 비용 지원', '• 국내/해외 컨퍼런스 비용 지원', '• 다과 및 커피 상시 구비', '• 경조사비 지원']","['Django', 'React', 'Python', 'TypeScript', 'AWS', 'Docker', 'PostgreSQL', 'Next.js']","봉은사로 213(논현동, 센트럴타워)"
135539,소프트웨어 QA,메디트(Medit),"['서울', '한국']","['인원급성장', '51~300명', '설립10년이상', '유연근무', '간식', '건강검진', '인공지능', '연봉상위11~20%', '제조']","['• 3D Data / Application에 대한 테스트 경험', '', '• Test Automation에 대한 운영 및 개발 경험', '', '• Web / Mobile / Windows Application Test에 대한 경험', '', '• 해외 출장에 결격사유가 없는 자']",,"['[복지]', '1. 근무 환경', '- 유연근무제', '- 수평적인 호칭 체계', '- 최고 사양의 업무 장비/ 소프트웨어', '- 웰컴키트 제공', '- 무제한 간식 자판기', '- 캐쥬얼 복장', '', '2. 역량 향상과 즐거운 복지', '-  해외 지사 파견', '- 매월 개인 소장용 도서 지원', '- 3년, 5년, 7년, 10년 이후 매 5년 근속 축하 상품권 및 휴가 제공', '', '3. 건강과 행복', '- 생일 반차 및 상품권 제공', '- 명절 상품권 제공', '- 다양한 경조사에 대한 지원', '- 종합 건강 검진', '- 임직원 상해 보험 가입', '- 심리상담(EAP) 지원', '*근무지에 따라 제공되는 베네핏은 상이할 수 있습니다.', '', '[기업문화]', '• 오픈 커뮤니케이션', '• 유연 근무제 실시', '• 직원 의견 존중 및 아이디어 권장을 통해 업무를 통한 성장의 기회 제공', '• 연차와 무관한 성과지향적 보상체계', '• 복장 자율', '• 자유로운 연차 휴가 사용', '', '[근무지]', '선유도 사옥 (서울특별시 영등포구 양평로25길 8)', '', '해당 포지션은 상시 채용 중으로 모집 완료 시 포지션이 마감될 수 있습니다.', '제출해 주신 내용 중 허위 사실이 있을 경우 채용이 취소될 수 있습니다.']","['Linux', 'Java', 'Python', 'AWS', 'UNIX', 'DevOps', 'Kubernetes']",서울특별시 영등포구 양평로25길 8
105447,"Senior Software Engineer, Backend",버킷플레이스(오늘의집),"['서울', '한국']","['연봉업계평균이상', '누적투자100억이상', '인원급성장', '301~1,000명', '설립4~9년', '리프레시휴가', '스톡옵션', '과일', 'IT, 컨텐츠']","['• 만 8년 이상의 백엔드 개발 경력을 보유하신 분', '• 컴퓨터공학 전공 혹은 그에 준하는 전공 및 지식을 보유하신 분', '• Kotlin/Java/Python/Ruby 등 하나 이상의 프로그래밍 언어 전문성을 보유하신 분', '• Public Cloud 기반 환경에서의 서비스 설계, 구축 및 운영 경험이 있는 분', '• MSA 설계 및 개발 경험이 있는 분', '• 전체 SDLC(소프트웨어 생명주기)에 대한 경험이 있는 분', '• 소규모 프로젝트 리딩 경험이 있는 분']","['• 대용량 트래픽 처리에 대한 이해 및 서비스 경험이 있는 분', '• 애자일 스프린트, MVP 단위 개발 프로세스에서의 개발 경험이 있는 분', '• AWS와 같은 Public Cloud 작업 경험이 있는 분', '• 인테리어 산업에 대한 높은 관심과 이해도가 있는 분']","['• 몰입과 성장을 위한 근무환경', '- 근무시간 자율 (6시~22시)', '- 최대 주 3회 재택근무제 운영', '- 결재 필요 없는 자유로운 휴가 사용', '- 도서, 컨퍼런스, 교육 지원', '- 조/중/석식 지원 ', '- 사내카페 무료 운영 ', '- 허먼밀러 의자 지급', '', '• 인재에 대한 아낌없는 보상', '- 최고의 인재에게 최고의 보상', '- 입사자 전원 스톡옵션 부여', '- 고기여자 대상의 스톡옵션 부여', '- 성과에 따른 전사 인센티브 지급', '', '• 함께 오래 가기 위한 케어', '- 건강검진 지원 (본인/배우자/양가 부모님)', '- 단체보험 지원 (본인/배우자/자녀)', '- 리프레시 휴가 및 장기근속 포상', '- 마음케어 프로그램 지원', '', '• 우리 일의 의미를 함께 경험하기 위한 지원', '- 오늘의집 꾸미기 지원금 연 120만원 지원', '- 오늘의집 구성원 전용 할인쿠폰 지원 및 VIP 승급', '', '', '[지원 및 진행 절차]', '• 지원서류 : 자유양식의 이력서(필수), 포트폴리오 및 커버레터(선택) / PDF 형식 권장', '- 연봉, 신체 정보, 가족 사항 및 주민번호 등의 민감한 개인정보는 제외 부탁드립니다.', '• 진행절차 : 서류 전형 ＞ 코딩테스트 ＞ 기술 인터뷰 ＞ 조직문화 인터뷰 ＞ 처우협의 ＞ 최종합격', '- 기술 인터뷰는 이력 및 경력 사항에 따라 1~2일에 걸쳐 진행되며, 자세한 인터뷰 프로세스는 인터뷰 진행 시점에 개별 안내드릴 예정입니다. ', '- 지원자의 이력 및 경력 사항에 따라 일부 과정이 생략되거나 추가될 수 있습니다.', '', '', '[기타사항]', '• 입사지원 서류에서 허위기재 사실이 발견될 경우, 입사가 취소될 수 있습니다.', '• 입사 후 3개월의 수습기간 내 온보딩을 위한 프로그램(Move in Program)을 진행합니다.', '• 국가유공자 및 장애인 등 취업보호대상자는 입사지원 시 증빙서류를 첨부하는 경우, 관계법령(국가유공자 등 예우 및 지원에 관한 법률, 장애인 고용촉진 및 직업재활법)에 따라 우대합니다. (지원서 작성 시 포트폴리오란에 첨부해주세요.)', '• 채용서류 반환 고지 : 채용 과정에서 오프라인으로 제출한 서류가 있을 경우, 채용절차의 공정화에 관한 법률 제11조 5항에 따라 해당 공고의 채용 여부가 확정된 이후 14일 이내에 반환을 요청할 수 있습니다. 반환 희망 시 버킷플레이스 채용 계정에 문의하여 반환을 청구해 주시기 바라며, 접수 후 14일 내 요청 서류를 등기우편으로 발송해 드립니다. 오프라인으로 제출한 서류는 당사자가 반환을 청구하지 않을 경우 14일까지 보관된 후 파기됩니다. 단, 홈페이지 또는 전자우편을 통해 제출한 일체의 서류, 당사의 요청이 없음에도 자발적으로 제출한 서류는 반환 청구 대상에 포함되지 않으며, 버킷플레이스 개인정보처리방침에 따라서 보유 된 후 파기됩니다.']","['Github', 'GraphQL', 'Hadoop', 'MongoDB', 'MySQL', 'Pytorch', 'Redis', 'Spark', 'Tensorflow', 'Java', 'Kotlin', 'Node.js', 'ObjectiveC', 'Python', 'Ruby', 'Swift', 'TypeScript', 'Tableau', 'C', 'Go', 'C++', 'REST', 'Jenkins', 'Docker', 'ElasticSearch', 'React.js', 'Spring Boot', 'Kubernetes']","서울특별시 서초구 서초대로74길 4(서초동, 삼성생명서초타워) 25층"
129300,풀스택 개발자,액티브스,"['서울', '한국']","['중식제공', '석식제공', '도서구매비', 'IT, 컨텐츠']","['-100% 자기 성장을 꿈꾸는 분', '-개발 경력이 2년 이상이거나 그에 준하는 실력이 있는 분', '-git을 이용한 형상 관리 및 코드 리뷰 경험이 있는 분']",['• 당면한 문제를 해결한 경험'],"['• 영어 이름을 기반으로 한 수평적 커뮤니케이션', '• 탄력적 근무제 ', '• 업무용 맥북(윈도우)제공 ', '• 중식 제공 및 야근 시 석식 제공', '• 무제한 도서 구입비 제공']","['TypeScript', 'API', 'Spring Framework', 'React Native']",방배로 15길 7
73976,Flutter 앱 개발자,한국공간데이터,"['서울', '한국']","['인원급성장', '51~300명', '설립4~9년', '스타트업', '커피', '과일', '간식', '건강검진', 'IT, 컨텐츠']","['❖ 이런 분을 기다리고 있습니다.', '', '• 하나 이상의 언어를 깊이 이해하고 프로젝트에 적용해 보신 경험이 있으신 분', '• 크로스 플랫폼을 설계하고 만들어 보신 경험이 있으신 분', '• 모바일 서비스의 개발, 배포, 서비스에 대한 이해가 있으신 분', '• Git, Jira, Monday 등의 협업 도구를 활용해 보신 분', '• 동료들과 협업하며 도움을 주실 수 있는 분', '• 3년 이상 다양한 프로젝트 개발을 경험해 보신 능력자 또는 앱의 구조를 고민하며 개발해 보신 분']","['❖ 이런 경험이 있다면 더욱 좋습니다.', '', '• Flutter의 다양한 라이브러리 사용 경험이 있으신 분', '• SaaS 플랫폼의 설계 및 구축 경험이 있으신 분', '• Native (Kotlin, Java, Object-C, Swift) 모바일 서비스 개발 경험이 있으신 분', '• HTTP, Rest API, OAuth 등 인터넷 기반 프로토콜 및 기술에 대한 이해 및 경험이 있으신 분', '• 새로운 도전을 즐기시는 분']","['★☆★ 한국공간데이터의 개발 문화는 함께 문제를 고민하며 계획하고 해결해 나가는 것이라고 할 수 있습니다. 각 개발자들은 먼저 풀어야 할 문제를 정의하고 계획한 다음, 같이 검토하고 나서 개발을 시작합니다. 이런 방법을 통해 비효율적인 낭비를 막을 수 있으며 도달하고 싶은 목표를 빠르게 달성할 수 있습니다. 또한 서비스의 다양한 메트릭 지표 및 오류까지도 데이터화해서 다시 서비스 개발에 반영하는 선순환 구조를 지향합니다.', '', '', '❖ 다음과 같은 환경에서 즐겁게 일하실 수 있습니다.', '', '• 맥 기반의 개발 환경을 맞추어 드립니다.', '• 사고 싶은 책과 업무에 필요한 교육을 지원해 드려요.', '• 맛있는 간식, 커피를 무한으로 즐길 수 있어요.', '• 업무가 끝났으면 당당하게 퇴근합니다. (눈치보면 이상한 사람 취급받아요!)', '• 용무가 있을 시 자유롭게 휴가를 사용합니다.', '• 주 1회 동료 개발자들과 기술적인 성장을 위한 세미나를 하며 논의를 합니다.', '• 생일날은 유급으로 반차를 제공합니다.', '• 건강을 위한 건강검진 할인을 제공해 드려요.']",,서울특별시 서초구 서초대로46길 19-12 서초안빌딩 2층
94402,[100억↑투자] 백엔드 엔지니어 (AI 로봇 관제 솔루션),다임리서치,"['서울', '한국']","['인원급성장', '50명이하', '설립3년이하', '스톡옵션', '스타트업', '음료', '커피', '간식', 'IT, 컨텐츠']","['- 하나 이상의 프로그래밍 언어를 능숙하게 활용 가능한 분 (Java, C#, C++ 등)', '', '- 데이터 실시간 처리 / 제어하는 서버 프로그램을 개발해 보신 분', '', '- 효율적인 데이터베이스 설계와 활용에 관심 있으신 분', '', '- 프로그램 표준화 / 모듈화의 가치를 이해하고 실행 가능하신 분', '', '- 데이터 모델링 및 시각화에 관심 있는 분', '', '- 제조 시스템 관련 도메인 지식은 필수 요건이 아니며, 새로운 기술/지식 습득에 적극적으로 임하시는 분', '', '- 스타트업 문화에 대한 이해도가 높고, 주도적으로 업무에 임하시는 분', '', '- 공동 목표를 가진 팀원들과 적극적으로 소통하며 업무에 임하시는 분']","['- 대용량 데이터 처리 서비스 경험이 있으신 분', '', '- C#, .Net Core 활용 경험이 있으신 분', '', '- PostgreSQL, MongoDB 활용 경험이 있는 분', '', '- MQTT, Kafka 활용 경험이 있는 분', '', '', ' **선호 인력 예시**', '', '- 산업 분야가 다르더라도 아래와 같이 “서버” 솔루션을 개발해 보신 분은 좋습니다.', '', '- 다수의 자율 주행 로봇을 통합 제어/모니터링 하는 서버를 설계 개발 해보신 분', '', '- 다중 사용자 접속 게임 서버를 설계 개발 해보신 분', '', '- 금융 IT 분야에서 다수의 접속자에 실시간 서비스를 제공하는 서버를 설계 개발 해보신 분', '', '- 건설/항만/빌딩관리 분야에서 다수의 설비를 제어/모니터링 하는 서버를 설계 개발 해보신 분']","['• 서울 강남 서초역 도보 3분 거리에 위치한 오피스', '• 시차출퇴근제 사용 (일 8시간 근무, 오전 7~10 사이 자율 출근)', '• 최고 사양의 개발 노트북과 모니터 제공', '• 점심 및 야근 식사 지원, 심야 택시 지원', '• 케익, 치킨, 피자 등 맛있는 간식과 함께, 직원들 간 화합을 위한 다과회 진행 (매월)', '• 생일 축하! 생일 직원에게 상품권제공 ', '• 건강도 챙겨가며 일해요, 지정병원 종합건강검진 제공 ', '• 스낵바 제공 (캡슐커피, 스낵, 음료 등 무제한 제공)', '• 우리 회사는 직원들의 문화 생활을 지원해요. 팀단합문화활동비 지원! ', '• 글로벌시대! 외국어 수강비 지원! (매월 10만원)', '• 사이닝 보너스 및 스톡옵션 협의 가능']","['Confluence', 'Git', 'JIRA', 'AngularJS', '.NET', '.NET Core', 'Oracle', 'Pytorch', 'React', 'VueJS', 'Web Socket', 'OpenGL', 'Unreal Engine', 'WebGL', 'ASP .NET', 'C#', 'Java', 'JavaScript', 'Python', 'TypeScript', 'C++', 'PostgreSQL', 'Entity Framework', 'Spring Framework', 'ORM', 'JPA', 'SVG', 'Unity3D']",서울 서초구 반포대로28길 20
139675,IoT 단말기 SW 개발 및 검토,아이엠에스커넥트,"['서울', '한국']","['리프레시휴가', '간식', '직무교육', 'IoT', 'IT, 컨텐츠']","['• 펌웨어 또는 임베디드 SW 개발 경험 총 3년 이상', '• embedded linux 개발 경험', '• F/W 개발 경험', '• 임베디드 환경에서 UART/BLE, TCP / IP 통신 경험']","['• 전자, 컴퓨터 관련 학과 전공자', '• 밝고 원활한 커뮤니케이션 능력을 지니신 분']","['• 자율 출/퇴근제 ', '   08:30 ~ 10:00 사이 자유롭게 출근 후 9시간(휴게시간 1시간 포함) 근무하고 퇴근', '• IMS(IMS.Connect) Welcome Kit 선물 증정', '• IMS커리어 년 최대 250만원 지원(직무교육, 체력단련 등)', '• 리프레시 휴가 지원(근속년수 3년,5년,7년 휴가 지원)', '• IMS Celebration 생일(승진) 선물 지급', '• 간식비 지원(매월 10일 GS25 기프티콘 지급)', '• 렌터카 대여비 지원(1개월 최대 10만원)']","['Git', 'Github', 'Java', 'JavaScript', 'TypeScript', 'JPA', 'React.js', 'React Native', 'Spring Boot', 'Restful API']",아차산로 355
129996,프론트엔드 개발자 (3년 이상),핀포인트,"['서울', '한국']","['건강검진', 'IoT', '재택근무', 'IT, 컨텐츠']","['• git, jira, slack을 통한 협업 경험', '• React.js 를 사용한 Web Front-end 애플리케이션 개발 능력']","['• HTML5, CSS3 퍼블리싱 역량 ', '• 모바일웹 애플리케이션 개발 경험', '• Rest API에 대한 이해 능력']","['[혜택 및 복지]', '• 자유로운 출퇴근 시간', '• 자유로운 업무 환경. 1인 개별 집중 업무 공간 이용 가능', '• 자유로운 연차 사용', '• 매월 업무지원금 30만원 지급', '• 주 40시간 이상 근무시, 보상 휴가 제공', '• 연차 외 정기휴가 별도 제공', '• 수평적 커뮤니케이션 (영어이름 사용)', '• 대기업 수준 건강검진 제공', '• (개발자 직군) 맥북프로, 듀얼모니터 제공', '• (개발자 직군) 주1회 재택근무', '', '[채용절차]', '• 서류전형 -＞ 실무 면접 -＞  경영진 면접 -＞ 처우협의 -＞ 최종합격.', '', '[지원유의사항]', '• 국문이력서 및 자기소개서 제출(자유양식)']","['Github', 'React.js', 'Kubernetes']","서울시 강남구 압구정로8길 26, 3층"
161234,[Delabs] 블록체인 개발자,네시삼십삼분(4:33),"['서울', '한국']","['인원급성장', '51~300명', '설립10년이상', '사내카페', '건강검진', 'IT, 컨텐츠']","['• 블록체인 관련 개발 2년 이상', '• 스마트컨트랙트 (Solidity) 개발 경험이 있으신 분']","['• 게임 서비스에 대한 이해가 있으신 분', '• Node.JS 사용 경험이 있으신 분']","['• 자기개발 포인트제도', '• 건강검진 지원', '• 단체상해보험 가입', '• 법인콘도 이용', '• 자기개발 지원', '• 각종 경조사 지원', '• 출산 선물 지원', '• 장기근속 포상제도', '• 사내 카페, 탁구장 등']","['Node.js', 'Blockchain', 'NodeJS']","서울 강남구 삼성로104길 22 2층 (삼성동, 예림빌딩)"
109506,DNN 모델 개발 엔지니어 [병특 포함],딥엑스,"['경기', '한국']","['인원급성장', '퇴사율5%이하', '50명이하', '설립4~9년', '스타트업', '음료', '커피', '간식', 'IT, 컨텐츠']","['ㆍ 정확한 의사 소통을 통한 근거 기반 업무 추진이 가능한 합리적인 직무 능력', 'ㆍ 다양한 딥러닝 모델에 대한 지식, 경험, 및 스킬', 'ㆍ 다양한 딥러닝 응용 모델에 대한 분석 기술', 'ㆍ 다양한 Task에 여러 데이터셋을 활용하여 딥러닝을 적용한 경험', 'ㆍ 다양한 딥러닝 모델 학습 및 개발에 대한 지식, 경험, 및 스킬', 'ㆍ 다양한 AI 프레임워크(Tensorflow, Caffe, Torch, ONNX) 개발 스킬을 보유하신 분', 'ㆍ DNN모델 최적화 지식 및 기술 (Quantization, Pruning, Knowledge Distillation 등) 중 1 개 이상의 스킬을 보유하신 분', 'ㆍ 편리한 쓰기 최적화+깨끗한 python 및 pytorch 코드']","['ㆍ Visual Transformer 등 최신 딥러닝 기법과 응용분야에 대한 지식을 보유한 분', 'ㆍ C++, Python 및/또는 CUDA에 대한 지식', 'ㆍ CI/CD 및 기타 소프트웨어 엔지니어링 관행을 따르는 애자일/스크럼 환경에 대한 경험', 'ㆍ 에지 배포 파이프라인 경험: 예: gstreamer 또는 opencv', 'ㆍ 게시된 코드 포트폴리오 관리']","['• 4대보험 (국민연금, 건강보험, 산재보험, 고용보험) 가입', '• 업무Tool Kit (최신 사양 노트북, 24~32인치 듀얼모니터, 스탠딩 데스크 등) 제공', '• 커피, 티, 두유, 비타음료 등 다양한 바리에이션의 음료와 간식 무한 제공', '• 점심, 저녁 든든한 식사 지원', '• 생일자 생일축하금(20만원) 지급 및 16시 조기 퇴근', '• 기혼자 결혼기념일축하금(20만원) 지급 및 16시 조기 퇴근', '• 미혼자 크리스마스축하금(20만원) 지급 ', '• 설/추석 명절선물비(30만원) 지급', '• 경조휴가 및 경조금 지급', '• 전직원 주식증여', '• 구성원 건강검진 지원 (2022.01부)', '★ 복지는 딥엑스의 성장과 함께 지속적으로 업그레이드 됩니다.']","['Linux', 'C / C++', 'Perl', 'Python', 'FPGA', 'SoC', 'Verilog', 'Embedded Linux', 'EDA', 'FPGA 프로토 타이핑']","경기도 성남시 분당구 판교역로 241번길 20, 미래에셋벤쳐타워 5F"
60926,백엔드 엔지니어 (Python),아이네블루메(채티),"['서울', '한국']","['퇴사율5%이하', '50명이하', '설립4~9년', '커피', '간식', '인공지능', 'IT, 컨텐츠']","['• Python 기반 웹서버 프레임워크를 활용한 개발이 가능하거나 관련 이해도가 있으신 분 (Django, Flask, FastAPI 등)', '• OS, Network 를 중심으로 컴퓨터공학에 대한 기본 지식이 탄탄하신 분', '• 클라우드(AWS, GCP, Azure 등)를 이용한 서비스 구축 및 운영 경험', '• 다음 항목 중 두 가지 이상에 해당되는 분', '   - AWS 혹은 GCP와 같은 클라우드 플랫폼 환경에서 AI 엔지니어링 경험이 있으신 분', '   - 리눅스 환경에 대해 잘 이해하고 계신 분', '   - 컨테이너 환경에 이해가 있으신 분', '• REST API에 대한 설계 및 개발 경험과 이해', '• 백엔드 개발 경력 3년 이상']","['• 테스트 자동화 및 테스트 코드 작성 경험', '• 아키텍처 설계에 관심이 있고 능동적으로 더 좋은 코드를 만들기 위해 노력하시는 분', '• 코드 리팩토링에 대한 경험과 이해가 높으신 분', '• 대규모 트래픽 처리에 대한 경험이 있으신 분', '• 대용량 데이터 처리 및 분석 경험이 있으신 분 (로그, 서비스 데이터 등)', '• Mircoservice, Serverless 아키텍처에 대한 경험이 있으신 분', '• Devops 경험 (Infrastructure as Code, 배포 자동화, CI, TDD, 모니터링 등)', '• 서비스에 대한 애착과 책임감이 있으신 분']","['채티는 이렇게 일해요!', '• 책임과 신뢰를 기반으로 개인의 자율성을 존중합니다', '• 의미 있는 실패를 지향하고 그 안에서 얻는 경험을 중시합니다', '• 스스로 문제를 찾고 적극적으로 해결합니다', '• 업무와 관련한 정보는 모두가 투명하게 공유합니다', '• 데이터 기반의 합리적이고 논리적인 의사결정을 지향합니다', '• 사용자 입장에서 생각하고 사용자 가치를 우선합니다', '• 누구든 자유롭게 의견을 말하고 적극적으로 피드백을 나눕니다', '• 서비스의 성장만큼 개인의 성장을 중시합니다', '', '채티는 이런 환경에서 일해요!', '• 콘텐츠 서비스 스터디를 위한 콘텐츠비 지원 (웹툰, 웹소설, 영화, 드라마 등)', '• 업무 관련 도서 구매 지원 (무제한)', '• 업무 관련 세미나 및 스터디 적극 지원 (애자일 코칭 등)', '• 투명하고 효율적인 커뮤니케이션을 위한 업무 도구 사용 (Google Workspace, Slack, Notion 등)', '• 업무 필요 장비 적극 지원 (최신형 맥북, 34인치 와이드 모니터, 모니터 암, 허먼밀러 의자)', '• 삼성중앙역 10초 거리', '• 점심 식대 제공, 야근 시 식대 및 교통비 지원', '• 편의점 간식 지원, 라운지에 드롱기 커피머신과 신선한 원두 구비', '• 개인물품을 보관할 수 있는 개인 락커 제공', '• 업무 환경 개선을 위한 피드백 적극 수렴 및 반영', '', '채티는 이런 동료와 함께 일하고 싶어요!', '• 콘텐츠(웹툰, 웹소설, 영화, 드라마 등)를 좋아하거나 관심이 많으신 분', '• 자유로운 업무 환경에서 신뢰와 책임을 바탕으로 스스로의 역할을 찾을 수 있는 분', '• 함께 일하는 동료를 존중하고 함께 성장할 수 있는 분']","['Django', 'MySQL', 'Python', 'AWS', 'Docker']",서울특별시 강남구 삼성로 571 K빌딩 8층
