id,title,company,location,tags,qualifications,preferred,benefits,skills,workplace
163112,Data Engineer (레이지나잇),무신사,"['서울', '한국']","['연봉업계평균이상', '인원급성장', '1,001~10,000명', '설립10년이상', '자율복장', '주차', '건강검진', '복지포인트', '판매, 유통']","['• Python으로 능숙한 개발이 가능하신 분', '• 다양한 데이터 소스로부터 데이터를 수집한 경험이 있으신 분 (DB, third party, log, streaming 등)', '• workflow manager(Airflow) 사용 경험이 있으신 분', '• 데이터 처리 및 가공을 위해 SQL 작성 능력이 있으신 분', '• RDB, NoSQL 및 Redis 등 데이터 소스 활용이 가능한 분', '• 대용량 데이터에 대한 ETL 또는 ELT 방식의 개념을 이해하고 계신 분', '• VCS(git, gitlab, github) 중 1개 이상 사용 가능 하신 분', '• 비즈니스를 고려해 데이터 모델링이 가능하신 분', '• 다양한 직군의 동료들과 원활하게 소통할 수 있으신 분', '• 새로운 기술을 끊임없이 접하고 적용할 수 있으신 분', '• 개발한 내용들을 정리하여 동료들과 공유할 수 있으신 분']","['• Java, Scala 로 개발이 가능하신 분', '• 클라우드 플랫폼(AWS, GCP 등) 중 1개 이상의 사용 경험이 있으신 분', '• RDBMS의 인덱스 또는 Bigquery의 클러스터, 파티션 개념을 이해하고 계신 분', '• 실시간 데이터 파이프라인 경험이 있으신 분 (spark, kafka, flink)', '• K8S(GKE/EKS) Container 기반 서비스 아키텍처 경험이 있으신 분', '• 데이터 모니터링 플랫폼(prometheus, grafana, elasticsearch, kibana) 개발 및 운영 경험이 있으신 분', '• 새로운 기술을 학습하고 업무에 적용한 경험이 있는 분']","['[근무환경]', '• 선택적 근로시간제 적용 (월 소정 근로시간 내 유연하게 근무)', '• 주 2회 재택근무 상시화', '• 월 1회 Early Friday 운영 (매월 마지막 금요일에는 4시간 근무 후 퇴근!)', '• 자율 복장 근무제 (슬리퍼부터 정장까지 자유롭게 입는 문화)', '• 직급 없이 ‘님’으로 소통', '', '[복지포인트]', '• 연 350만 복지포인트 지급', '- 자기계발(교육, 도서 구매, 운동, 문화생활 등), 가족 건강검진, 육아용품 구매, 주차비 등 온&오프라인에서 사용 가능한 포인트', '', '[건강/휴식]', '• 연 1회 건강검진, 연 10회 심리상담 지원', '• 3년, 6년, 9년, 12년 만근 시, 추가 복지포인트 및 포상휴가 제공', '• 1일(8시간), 0.5일(4시간), 0.25일(2시간) 단위로 유연하게 사용 가능한 휴가', '', '[무신사 스토어 혜택]', '• 월 10만원 한도로 무신사/29CM/레이지나잇/솔드아웃 사이트 내 쇼핑 지원금 지급 (Self-Love 비용)', '• 생일 월에는 무신사 패밀리 사이트 내 제품 구매 시 쇼핑 지원금 20만원 지급', '• 자사 사이트 할인 혜택 제공', '', '[사내 생활 지원]', '• 자녀 초등학교 입학 시 입학 축하금, 자녀 대학 입학 시 대학등록금 지원', '• 사내대출제도 운영 및 일정 비율의 대출이자 지원', '• 경조 휴가 및 경조금 지원', '', '[수습기간]', '• 입사일로부터 3개월 / 급여 100% 지급']","['Git', 'Android', 'iOS', 'MySQL', 'JavaScript', 'Kotlin', 'Node.js', 'PHP', 'Swift', 'AWS', 'Product Management ', 'Spring Framework', 'QA 엔지니어링']","04779 서울시 성동구 아차산로 38 개풍빌딩(성수동1가, 스파크플러스)"
152114,플랫폼팀 백엔드 엔지니어 (시니어 +5년),와이어드컴퍼니,"['서울', '한국']","['연봉업계평균이상', '인원급성장', '51~300명', '설립4~9년', '식비', '맥주', '커피', '택시비', 'IT, 컨텐츠']","['• [필수] 백엔드 개발 경력 5년 이상', '• AWS를 활용한 개발, 운영 경험을 보유하신 분', '• 테스트 코드를 적극적으로 활용해보신 분', '• 기획 / 디자이너 / 운영 등 다양한 직군과의 협업 경험', '• 스타트업 초기 팀 빌딩 경험']","['• 새로운 기술에 관심이 많고, 자기 개발을 위해 노력하시는 분', '• GraphQL에 대한 경험 및 이해', '• Node.js 기반 개발 경험', '• 대규모 트래픽 처리 시스템 설계 및 개발 경험', '• MSA(Microservices Architecture) 경험', '• AWS(Amazon Web Services) 경험', '• 버전관리 시스템 및 전략에 대한 이해', '• TDD(Test Driven Development) 개발 경험', '• Peer Code Review 경험', '• 다양한 커뮤니티 및 오픈소스 활동']","['| 와이어드에서 지원해드려요.', '', '  구성원의 행복한 일과 삶을 위해', '', '• 업무효율이 좋은 곳이라면 그곳이 어디라도 근무가 가능한 자유로운 근무문화를 지원합니다.', '• 출근을 희망한다면 8시에서 10시 사이에 자유롭게 출근 해주시면 됩니다.', '• 열심히 달려온 구성원에게는 안식년 휴가를 제공합니다.', '• 아무리 급해도 점심은 1시간 반 동안 천천히 드세요.', '• 매월 별도 20만원의 맛집 포인트를 점심 식대로 지원합니다. 드시고 싶은 음식은 마음껏 드세요.(법인카드는 3개월의 온보딩 기간이 종료된 후 지급하며, 온보딩 기간에는 공용법인카드로 식사합니다. 재택근무를 하시는 경우에는 개인카드로 결제 한 뒤 일괄로 품의를 진행합니다.)', '• 당이 떨어지는 오후를 위해 사무실에는 음료와 커피머신을 포함한 스낵바가 마련되어 있습니다.', '• 너무 바쁘거나 재택근무로 팀끼리 만나지 못했다면 한 달에 한 번 점심 혹은 저녁을 함께 드시라고 모임 비용을 지원해드립니다. (인당 5만 원)', '• 쉬고 싶을 때 마음껏 아무것도 생각하지 말고 쉴 수 있도록 무제한 연차 제도를 지원합니다. ', '(온보딩 기간에도 동일하게 적용)', '', ' 구성원의 무한한 성장을 위해', '', '• 업무와 개인 성장에 도움이 되는 컨퍼런스와 밋업 등의 참여를 지원하고 장려합니다.', '• 도서 구입비와 직무 교육비를 지원해드립니다. (매월 신청을 통해 독서토론회를 진행합니다.)', '• 업무에 몰입할 수 있는 500만 원 상당의 원하는 개인 장비를 지원합니다. (모니터 외의 이동이 불가능한 장비는 구매가 불가능합니다.)', '• 열심히 일한 만큼 보상하는 인센티브 제도를 운영합니다.']",,"강남구 테헤란로 518, 13층"
161771,ERP 프로젝트 구축 총괄,올리브인터내셔널,"['서울', '한국']","['상여금', '식비', '커피', '생일선물', '택시비', '건강검진', '문화비', '판매, 유통']","['[이런 분과 함께 성장하고 싶습니다]', '', '• 사내 IT 팀 경험을 보유하신 분', '• ERP 시스템 구축 경험을 보유하신 분']","['[이런 분이면 더욱 좋습니다]', '', '• 5년 이상 시스템 운영/구축/관리 경험자 우대', '• 온라인 쇼핑 관련 / ERP 관련 PM 경험자 우대', '• ERP 구축 관련 컨설팅/PI 경험자 우대']","['[올리브인터내셔널이 드릴 수 있는 것들이에요]', '', '', '1. 업무 환경 지원 ', '', '• 장비 지원 ', '   - 구성원들이 쾌적하게 업무를 할 수 있도록 데스크탑과 최신형 모니터 2대를 제공합니다. 이외에도 목건강을 위해 모니터 받침대를 제공합니다. 디자이너에게는 필요하실 경우 펜 태블릿을 제공해드립니다.', '', '• 사내 추천 리워드 100만원 지급 ', '   -사내 추천을 통해 입사하신 분이 수습 기간을 통과하실 경우, 추천인에게 100만원을 지급합니다.', '', '• 장기근속 리워드(3/5년)', '    - 오랜 기간 함께해주신 분들에게 감사의 의미를 담아 리워드를 드립니다.', '    - 3년 근속하신 분들에게는 휴가비용을, 5년 근속하신 분들에게는 5일의 유급휴가와 해외여행을 선물해드립니다.', '', '2. 몰입과 휴식을 위한 지원 ', '', '• 점심, 저녁 식대 지원', '    - 회사에서는 업무에 집중할 수 있도록 인당 1만원 이내에서 점심, 저녁 식대를 제공합니다.', '', '• 교통비 지원', '    - 야근하는 경우 구성원들의 안전한 귀가를 위해 택시비를 지원합니다. 또한 외근 및 출장시에도 교통비를 지원합니다.', '', '• 초과근로 인센티브 지급', '    - 회사의 성장을 위해 노력해주신 구성원분들에게 충분한 보상을 해드리고자 초과근로 인센티브를 지급합니다.', '', '• 10시 출근 및 금요일 시차출퇴근제 실시', '    - 출퇴근길에 가장 붐비는 시간대를 피해서 10시 출근, 7시 퇴근을 실시합니다.', '    - 금요일에는  시차출퇴근 제도를 실시합니다. 오전8시~10시 사이에 원하는 시간대에 출근해서 업무를 시작합니다.', '', '• 커피무제한', '    - 커피는 무제한으로 제공하고 있습니다.  테라스에서 커피 한 잔 할래요? ', '', '• 반기별 인센티브 제공', '    - 개인의 성과에 따라 보상을 제공합니다. 당신의 열정과 노력에 걸맞는 대우를 해드리겠습니다.', '', '3. 소중한 관계 유지를 위한 지원', '', '• 팀 커뮤니케이션 비용 지원', '    - 구성원과의 충분한 소통을 위해 회식비를 지원합니다.', '', '• 경조사 지원', '    - 구성원들의 기쁜 일, 슬픈 일에 충분한 축하와 위로를 해드리고자 경조사가 생기면 경조휴가,  경조사비, 화환을 지원합니다.', '', ' • 생일 선물', '    - 1년에 한 번 오는 생일, 축하의 마음을 담아 생일케이크, 2시간 조기퇴근, 생일 축하금(10만원)을 지원해 드려요', '', '•  명절 선물', '    - 풍요로운 명절 가족, 친구들과의 행복한 시간 보내시도록 명절(설,추석)에 상여금을 지급해드립니다.', '', '•  ‘님’ 호칭 문화', '    - 존중하는 문화에서 최고의 성과를 만들어낼 수 있다고 믿습니다. 연차에 상관 없이 동일한 직책인 경우에 님으로 호칭하며 커뮤니케이션을 하고 있습니다.', '', '4. 구성원 개개인을 위한 지원', '', '•  문화비 연 100만원 지급', '    - 구성원의 복리후생을 위해 100만원까지 문화비를 지급해드립니다.', '', '•  출산 축하 선물 지원', '    - 새로운 가족이 생기는 구성원들에게 축하 선물을 지원해드립니다. 출산 예정인 산모 또는 출산 예정인 산모의 배우자 모두 신청 가능합니다.', '', '•  자사 브랜드 임직원 할인 최대 80%', '    - 자사 브랜드 제품을 할인가로 부담없이 이용하며 올리브인터내셔널에 대한 이해도를 높일 수 있습니다.', '', '•  종합 건강검진 지원', '    - 구성원의 건강한 삶을 위해  건강검진을 지원합니다. (20만원 상당)']",,"강남구 논현로79길 12(역삼동), AK빌딩(구.바운빌딩)"
133254,IT지원(서버개발),이디야,"['서울', '한국']","['인원급성장', '301~1,000명', '설립10년이상', '워크샵', '커피', '와인', '사내카페', '동호회', '판매, 유통']","['- 담당직무 관련전공자', '- 총 경력 5년이상']","['＜해당경험우대＞      ', '', '- 데이터베이스 설계/구축/운영 경험', '', '- 서버 운영체제(클라우드 포함) 설계/구축/운영 경험', '', '- JAVA 개발', '', '- Spring Framework 기반의 애플리케이션 개발', '', '- 결제서비스가 포함된 플랫폼 개발 경험', '', '- React를 이용한 Front-end 개발 경험', '', '- 클라우드 서비스(AWS, GCP 등) 운영 경험', '', '- 빌드/테스트/배포 자동화 경험', '', '- MicroServices 아키텍처 기반의 시스템 개발 경험', '', '', '＜해당역량우대＞', '', '- PM 역할 수행 및 유지보수 운영 경험', '', '- 품질 좋은 시스템과 코드를 만들기 위해 항상 노력하는 분', '', '- 새로운 기술을 배우며 동료와 함께 성장하기 원하는 분']","['이디야의 복리후생제도와 사내문화를 소개합니다', '', '[복리후생 제도]', '', '•  사내 카페테리아 무제한 이용(외부 이디야커피와 동일한 사내 카페테리아)', '', '•  조, 중, 석식 지원 (구내식당)', '', '•  자기계발비 (월 최대 10만원) 지원', '', '•  도서구입비 (월 3만원 지원) ', '', '•  생일자 백화점 상품권 지급  ', '', '•  임직원 단체 상해보험(실비보험) 가입', '', '•  직원경조금 및 경조휴가 지급', '', '  - 부모님, 조부모님, 기혼자의 경우 기혼자의 부모님, 조부모님 경조사시 경조금이 지급됩니다', '', '    (회갑/칠순/팔순 등 각 50만원 축하금 및 10만원 상당의 꽃다발, 조의금 내용 및 대상 동일) ', '', '  - 출산, 자녀 첫 돌 축하금, 형제자매 결혼 (각 30만원) ', '', '• 우수사원 및 근속사원 포상', '', '  - 근속 5년, 10년, 15년 각각 금 5돈, 10돈, 15돈 지급 및 포상휴가 5일, 10일, 15일 지급 ', '', '• 전세자금 무이자 대출', '', '  - 근속 3년이상, 선임매니저(과장) 이상 무이자 5천만원 전세자금 대출 ', '', '• 자녀 학자금 지원 ', '', '  - 근속 2년 이상 임직원 자녀 학자금 지원 ', '', '', ' ', '[조직문화 소개] ', '', '• 월 2회 패밀리데이 1시간 조기 퇴근', '', ' - 매월 첫째주 월요일, 마지막주 금요일 패밀리데이', ' ', '• 신규입사자 멘토링', '', '  - 조직적응을 위한 멘토링활동 비용 지원', ' ', '• 동호회 활동비 지원 ', '', '  - 사내 동호회 활동을 지원합니다 (골프, 축구, 와인, 맛집 동호회 등 10개 동호회 운영중)', '', '• 해외워크샵 지원', '', '  - 입사 1년 이상 임직원 대상 해외워크샵을 지원합니다.', '', '• 수평적인 문화 - 호칭제 ', '', '  - 수평, 협업적인 조직문화 구축을 위한 호칭제 시행(직책자 제외 매니저로 호칭 통일) ', '', '• 신규입사자 입사시, 웰컴기프트 및 케익 제공']","['SQL', 'AWS', 'POS', 'RFP', '네트워크 설계']","서울특별시 강남구 논현로 636, 이디야빌딩"
163137,Back-end Server Developer (3년 이상),하이어엑스,"['서울', '한국']","['자기계발', 'Macbook', 'IT, 컨텐츠']","['우리는 이런 분과 함께하길 원해요', '', '- 3년 이상의 백엔드 개발 경력 및 기획, 설계 또는 그에 준하는 경험이 있으신 분', '- java, node.js 개발 가능자', '- RDBMS에 대한 이해를 바탕으로 활용 가능하신 분', '- AWS, Linux 환경에서 개발 및 운영 경험이 있으신 분', '- RESTful API 에 대한 이해가 있으신 분', '- 외부 연동/제공 API 개발 경험 또는 그에 필요한 기술 이해가 있으신 분', '- Git 등의 분산 버전 관리 시스템 이용 경험이 있으신 분']","['우리는 이런분을 우대해요', '', '- Typescript, python 등 다양한 언어 또는 프론트 개발 경험이 있으신 분', '- 백엔드, 프론트엔드 연계한 기획, 설계 경험이 있으신 분', '- Docker 또는 Kubernetes 기반의 CI/CD 운영 경험이 있으신 분', '- MSA 기반 서비스 개발/운영 경험이 있으신 분', '- 운영 자동화 및 시스템 최적화 구축 경험이 있으신 분', '- RDBMS, NoSQL에 대한 이해와 DB 설계 경험이 있으신 분', '- 앱/웹 서비스 출시 및 팀 성장에 기여한 경험이 있으신 분']","['우리는 이런 혜택&복지를 제공해요.', '', '- 자율 탄력근무 제도', '    - 오전 8.5시 ~ 11시 중 원하는 시간에 자유롭게 출근하고 퇴근하세요(8시간 근무)', '', '- 일 하고 싶은 곳에서 자유롭게, 리모트 근무', '    - 주 3일(수, 목, 금)은 원하는 곳에서 자율적으로 일하세요', '', '- 점심 식대 지원', '    - 개인 법인카드를 제공해요', '    - 만일 업무가 길어진다면, 야근 식대도 당연히 지원해요', '', '- 자기계발비 지원', '    - 도서 구매 및 강의 수강 지원', '    - 세미나, 커뮤니티 개최 및 참여 지원', '', '- 그 외', '    - 그 누구도 눈치 주지 않는, 자유로운 퇴근 문화', '    - 규율과 자율 위 주도적인 업무 환경 및 성장 기회 제공', '', '', '[채용 프로세스]', '', '- 지원자의 이력 및 경력 사항에 따라 일부 면접 과정 및 코딩 테스트가 생략되거나 추가될 수 있습니다.', '    ', '    1차 : 서류 전형', '    ', '    2차 : 과제 진행 (서류 전형 합격자에 한해, 과제 전달)', '    ', '    3차 : 실무 & 팀적합도 인터뷰 (과제 검토 후, 합격자 인터뷰)', '    ', '    *인터뷰 합격 후 처우 및 급여협의', '', '', '[참고사항]', '', '- 해당 공고는 수시 채용으로, 채용 완료 시 조기에 마감될 수 있습니다.', '- 입사지원 서류에서 허위기재 사실이 발견될 경우, 입사가 취소될 수 있습니다.', '- 해외여행 결격 사유가 있을 시, 입사가 취소될 수 있습니다.', '- 필요시 회사는 귀하가 제공하시는 이력서를 기초로 평판조회(레퍼런스 체크)를 시행할 수 있습니다. 이에 동의하시는 경우 이력서를 제출해 주세요.', '- 입사 후 3개월간의 온보딩(수습 기간)이 진행됩니다. 온보딩 기간 동안의 급여는 100% 지급됩니다.']","['Java', 'AWS', 'Spring Boot']",서울 강남구 테헤란로55길 17 어반9 빌딩 5층 하이어엑스
136677,백엔드 개발,아이쿱,"['서울', '한국']","['연봉업계평균이상', '인원급성장', '50명이하', '설립10년이상', '성과급', '휴게실', '결혼기념일', '건강검진', 'IT, 컨텐츠']","['• 학력 : 전문학사 이상', '• 경력 : 3~10년', '• Java 8 이상/Spring Boot 2.x 이상/JPA 기반의 개발 경험', '• RDBMS 기반의 데이터베이스 활용 경험', '• REST API 개발 경험']","['• AWS를 활용한 개발 및 운영 경험', '• 도메인 주도 설계(DDD) 지식 및 경험']","['※ 근무 환경', '• 근무형태: 정규직(수습기간 3개월, 임금동일)', '• 근무요일/ 시간: 주5일(월~금)/ 일 8시간 근무(시차출퇴근제)', '• 근무장소: 역삼(1분기 여의도 근무)', '• 급여: 역량, 경력에 따라 협의', '', '※ 복리후생', '• 휴가: 반차, 연차, 휴일 및 대체 공휴일 유급 휴무', '• 반차: 생일 및 결혼기념일 ', '• 사유를 묻지 않는 연차 사용', '• 조직 문화: 회식 및 야근 강요 안함', '• 야근 식대 및 야간 교통비 지원', '• 업무 관련 도서 및 교육비 지원', '• 경조비 및 근조화 지원', '• 목표 달성에 따른 성과급 지급', '• 자유로운 복장', '• 단체상해보험, 건강검진 제공', '• 청년내일채움공제 지원', '• 휴게실, 회의실, 사무용품 지급', '', '※ 전형절차 및 기타사항', '• 접수기간 : 2023.01.12(목) ~ 채용시 마감', '• 전형절차 : 서류전형 ＞ 1차면접 ＞ 2차면접(필요시) ＞ 입사', '• 면접 참석자에게 소정의 면접비 지급', '• 전형 절차는 일정 및 상황에 따라 변동 될 수 있습니다.', '• 진행 일정은 확정되는대로 지원자분들에게 개별 안내 예정입니다.', '• 본 채용은 모집 기간 내에 인재 선발 완료 시 공고가 마감될 수 있습니다.']","['VueJS', 'TypeScript']",
156432,프론트엔드 개발자,핸들,"['서울', '한국']","['연봉업계평균이상', '인원급성장', '50명이하', '설립4~9년', '스타트업', '커피', '간식', '헬스장', 'IT, 컨텐츠']","['ㆍ javascript, html5, CSS, ES5, ES6 능숙하게 활용이 가능하신 분', 'ㆍ React Native, Flutter와 같은  Frontend 서비스 개발 및 운영 경험이 있는 분', 'ㆍ 2년 이상의 Frontend 서비스 개발 및 운영 경험이 있는 분', 'ㆍ 다양한 오픈소스 라이브러리 연동 경험이 있으신 분', 'ㆍ Typescript를 실무에 적용한 경험이 있으신 분', 'ㆍ Git과 GitHub를 사용한 버전 관리와 협업 경험이 있으신 분', 'ㆍ Redux, Mobx와 같은 상태 관리에 대한 경험과 이해가 높으신 분', 'ㆍ 백엔드 개발자, 디자이너 등 동료와 협업 경험이 있으신 분', 'ㆍ 다양한 브라우저 환경에 대응하는 서비스 개발 경험이 있으신 분']","['ㆍ RESTful API, graphQL 경험이 있으신 분', 'ㆍ ios, android 네이티브 운영 경험이 있는 분', 'ㆍ Node.js 환경에서 개발 경험이 있으신 분', 'ㆍ webpack, Lint등을 이용한 개발 경험이 있으신 분', 'ㆍ  서버 사이드 렌더링(SSR)에 대한 이해 및 처리 경험이 있는 분', 'ㆍ frontend 서비스의 테스트 및 CI/CD 경험이 있는 분']","['• 핸들은 구성원들이 최고의 성과를 낼 수 있도록 다양한 복리후생 프로그램을 계획하고 있으며, 더 좋은 근무환경과 조직문화를 만들고자 지속적으로 연구하고 있습니다.', '', '', '[효율적인 업무 집중을 위한 사무환경 및 휴게공간]', '• 업무에 몰입할 수 있는 사무공간 제공', '• 직무별로 최적의 장비와 소프트웨어 제공', '• 카페인과 당이 떨어지지 않도록 커피머신 및 간식 비치', '• 든든하게 먹고 일하도록 중식 지원', '• 지치고 힘들때 쉴수 있는 요기보가 비치된 휴게공간', '', '', '[조직문화]', '• 수평적 커뮤니케이션(모든 구성원이 ""님"" 호칭 사용)', '• 자유로운 의견 교환 가능', '• T(Time) P(Place) O(Occasion)에 맞게 개성을 표현할 수 있는 자유로운 복장', '• 시차출퇴근제 도입', '', '', '[기타사항]', '• 경조사비 지원', '• 직원의 건강을 위한 체력단련비 지원(제휴 헬스장 연계)', '• 책은 마음의 양식 (도서구입 지원)', '• 앞으로 늘어날 다양한 혜택과 복지(Coming soon...)']","['Git', 'Github', 'GraphQL', 'React', 'JavaScript', 'Node.js', 'TypeScript', 'HTML5', 'RESTful WebServices', 'React Native', 'ES6']","서초구 사임당로 171, 12층 (주)핸들 서울사무소"
40521,블록체인 지갑 개발자(백엔드),피어테크(지닥),"['서울', '한국']","['연봉업계평균이상', '퇴사율5%이하', '50명이하', '설립4~9년', '육아휴직', '출산휴가', '스톡옵션', '스타트업', '금융']","['- 현업 개발 경력 2년 이상(연차보다는 실력을 중시합니다) ', '- 상용 서비스/제품 개발에 참여해보고 운영해보신 분', '- 새로운 기술에 대한 흥미와 학습을 스스로 하실 수 있는 분', '- 본인이 개발한 부분에 대해 다른 개발자들에게 설명할 수 있고 원활한 소통이 가능한 분']","['-  가상자산(디지털 자산), 금융, 블록체인에 대한 관심과 이해']","['피어테크는 구성원들이 뛰어난 동료들과 함께 최고의 퍼포먼스를 낼 수 있도록 다양한 복리후생 프로그램을 제공하며, 더 좋은 근무환경을 만들기 위해 지속적으로 연구하고 있습니다.', '', '', '[업계 최고 복지혜택]', '- 든든하게 점심식대 지원', '- 본인과 가족의 건강검진 지원', '- 개인 법인카드로 편리하게, 석식 지원', '- 외근, 야근 교통비 지원', '- 듀얼 모니터, MAC 및 필요 최신장비 제공', '', '[커리어 개발 지원]', '- 최신식 금융 시스템 및 혁신 트렌드 선도', '  (클라우드 기반 업무환경, 블록체인, 디지털 자산, CBDC, 결제, 금융상품 등)', '- 꾸준한 지식습득 장려 도서비 지원', '- 업무 역량강화 교육비 지원', '', '[업무 효율 최우선]', '- 최신식 클라우드 업무 환경 ', ' (AWS, G-suite, Slack, Atlassian, 1Password 등)', '- 지하철 2호선, 9호선 근접한 편리한 교통', '', '[추가 포상제도]', '- 평가를 통한 인센티브 제공', '- 기여도에 따른 스톡옵션 기회 부여', ' ', '[휴게공간]', '- 아침마다 채워지는 식사대용 간편식과 과일', '- 내가 원하는 간식 언제든지 스낵바 이용', '', '[경조사 지원]', '- 본인과 가족의 출산과 육아지원 출산휴가/육아휴직', '- 기쁨과 슬픔도 함께하며 경조사비 및 경조휴가', '- 직원들의 생일도 함께 사내 생일파티']",,"서울 강남구 봉은사로 112길 6 , 3층 (익성빌딩)"
