id,title,company,location,tags,qualifications,preferred,benefits,skills,workplace
136783,AI Research Engineer,시나몬,"['서울', '한국']","['유연근무', '리프레시휴가', '스톡옵션', '스타트업', '와인', '간식', '컨퍼런스참가비', '인공지능', 'IT, 컨텐츠']","['• 2년 이상의 관련 실무 경력 혹은 석/박사 학위', '• 연구개발을 위한 프로그래밍 & 딥러닝 프레임워크 (Tensorflow, PyTorch 등) 활용 역량', '• 원활한 커뮤니케이션 역량', '', '', '※참고사항', '- AI Research Engineer 포지션은 서류통과 시, 코딩테스트를 진행하고 있습니다.', '- 전형 절차는 일정 및 상황에 따라 변경될 수 있으며, 전형별 결과에 따라 절차가 추가될 수 있습니다.', '- 정규직 채용의 경우 3개월의 수습기간이 있으며, 평가 결과에 따라 수습 기간이 연장되거나 채용이 취소될 수 있습니다.', '- 지원서 내용 중 허위 사실이 있는 경우에는 합격이 취소될 수 있습니다.']","['• 주요 학회 및 저널 논문 게재 실적', '• 아래 기술과 관련된 연구/프로젝트 경험', '    - Facial expression, 3D human motion', '    - Voice conversion, Text-to-speech', '    - Natural language processing', '    - Generative models', '    - Neural rendering', '• 뛰어난 소프트웨어 엔지니어링 역량']","['• 폭발적으로 성장 중인 글로벌 스타트업의 초기 팀원', '• 역량에 걸맞는 연봉 및 스톡옵션 제공', '• 무제한 자율 휴가 제도', '• 근속 2년차에 리프레시 휴가 2주 및 휴가비 지급', '• 주 5일제, 유연 근무 제도', '• 점심 식사비 2만원 지원', '• 내가 신청한 간식이 냉장고에 그득그득', '• 원하는 원두를 에스프레소 머신으로!', '• 컨퍼런스 참가비, 도서 구입 등 개인 성장 적극 지원', '• 전직원 최고급 장비(Mac, PC, 전동 스탠딩데스크 등) 지원', '• 원하는 모든 소프트웨어는 정품으로 구매하여 제공', '• 편리한 사무실 위치 (강남역 우성아파트 사거리)']",,서울특별시 서초구 효령로77길28
115036,데이터 엔지니어(그로스해커),페이타랩(패스오더),"['부산', '한국']","['인원급성장', '51~300명', '설립4~9년', '식비', '커피', '간식', '건강검진', '산업기능요원', 'IT, 컨텐츠']","['【이런 분을 찾고 있어요!】', '', '• 데이터 분석, 파이프라인 및 데이터 기반 서비스 관련 업무 경험이 있는 분', '• 데이터를 통계적으로 이해하고 데이터를 정리하여 요약할 수 있는 분', '• 데이터를 통해 인사이트와 솔루션을 제공할 수 있는 분', '• 데이터에 대한 수학적 이해와 통계적 지식을 보유한 분', '• SQL, Python, R 등 통계/분석 프로그램을 능숙하게 다룰 수 있는 분']","['【이런 분이면 더 좋아요!】', '', '• 데이터 관련 학과(통계학, 전산학, 컴퓨터 공학 등)를 전공하신 분', '• 미적분학, 선형대수학, 확률, 통계, 경제학 등에 대한 전문 지식이 있는 분', '• 통계 분석, 데이터마이닝 등 유관 업무를 경험하신 분(석, 박사 포함)', '• 머신러닝 등 최신 알고리즘을 활용한 실제 비즈니스 문제를 해결한 경험이 있는 분', '• 대용량, 실시간 데이터를 처리 아키텍처 구축과 관련된 경험이 있는 분', '', '', '【페이타랩의 근무 문화 및 환경】', '', '• 구성원 모두가 서로 단단하게 연결되어, 모든 정보를 투명하게 공유하고, 각자의 업무에 몰입할 수 있는 환경', '• 최소한의 절차로 일에만 집중할 수 있으며, 의사결정과 각자의 책임이 명확한 효율적인 환경', '• 누구나 원하는 만큼 성장하며 커리어를 쌓을 수 있도록 회사가 적극적으로 지지하고 지원해주는 환경', '• 뛰어난 실력과 따뜻한 마음을 가진 멋진 동료들과 함께 할 수 있는 환경']","['【저희는 이렇게 일해요!】', '', '1. 완벽한 결과물은 없다고 생각해요. 빠르게 실행해보고 아니면 개선해나가요.', ""2. 그냥 하는 일은 없어요. 스스로 업무를 할 때 '왜?'를 항상 생각해요."", '3. 하나의 팀으로 서로 단단하게 연결되어 있기 위해 사내의 모든 정보는 투명하게 공유하고 있어요.', '4. 직책 및 연차에 상관없이 모든 구성원이 자유롭게 소통하고 대담하게 피드백을 주고받아요.', ""5. 수평적인 문화를 지향하고 있어요. 직급 대신 모두에게 '님'이라는 호칭을 사용해요."", '6. 업무는 수직적으로 해요. 책임을 지는 의사결정권자와 실무자의 구분을 명확히 해요.', '7. 가족이 아닌 스포츠팀처럼 각자의 포지션에서 최고가 되기 위해 끊임없이 배우고 노력해요.', '8. 일은 힘들 수 있지만, 사람 때문에 힘든 일은 없어요. 구성원들은 서로를 진심으로 아끼고 배려해요.', '9. 저녁 회식이 없어요. 다음 날 최상의 컨디션으로 일할 수 있도록 회사가 방해하지 않아요.', '', '', '【이런 것들을 지원해 드려요!】', '', '■ 효율적으로 생각하고, 움직일 수 있도록', '• 2호선 삼성역 5분 거리, 커뮤니티 매니저가 상시 관리하는 최신 시설의 단독 오피스(서울)', '• 1호선 서면역 5분 거리, Creative가 넘치는 상상마당에 위치한 오피스(부산)', '• 개인별 법인카드 지급(식대, 출장 등에 사용)', '• 점심 식사 지원(점심, 저녁식사 비용 1만 1천원)', '• 야근 시 저녁 식대, 야근교통비 지원', '• 자유로운 복장', '• 저녁 회식 없는 문화', '• 사유를 묻지 않는 연차 사용', '', '■ 업무에 몰입하고, 원하는 만큼 성장할 수 있도록', '• 교육, 세미나, 컨퍼런스 참여 비용 무제한, 전액 지원(참가비 전액, 출장비, 식비 모두 지원)', '• 온라인 콘텐츠 구독 지원', '• 도서 무제한 구입 지원', '• 최고 스펙의 개인별 맞춤 디바이스 제공(iMac, Macbook Pro, 데스크탑, 노트북 등)', '• 27"" 듀얼모니터 제공', '• Logitech 무선 키보드, 마우스 제공', '• 원하시는 분은 버티컬 마우스 추가 제공', '• 쾌적한 업무환경 제공(스타일러, IQ Air, 가습기)', '', '■ 함께하는 구성원이 행복할 수 있도록', '• 생일 축하 백화점 상품권 지급', '• 명절 백화점 상품권 지급', '• 건강검진 지원 (연 1회 종합건강검진)', '• 패스오더 포인트 매월 지급 (50,000P)', '• 모든 오피스 내 스낵바 운영', '• 에스프레소 머신, Tea, 간식 무제한 제공', '• 구성원끼리 공유하는 맛집 리스트 운영', '• 구성원 경조사 발생 시 근조화환 및 경조 휴가, 경조금 지원', '• 결혼 시 결혼축하금 100만원 지급', '', '', '【이런 여정을 거치게 되실 거예요!】', '', '서류전형 ＞ 1단계 (직무면접) ＞ 2단계 (컬쳐 핏) ＞ 3단계 (서류, 레퍼런스 체크) ＞ 최종합격', '', '• 개발자 및 일부 포지션의 경우 서류전형 다음으로 사전 테스트(코딩테스트, SQL 테스트)를 진행해요.', '• 1단계 전형부터는 합격 여부와 관계없이 결과를 안내 드리고 있으며, 결과는 알림톡 및 메일을 통해 안내를 드리고 있어요.', '• 레퍼런스 체크를 진행하게 될 시, 사전에 지원자님께 반드시 동의를 구하고 진행해요.', '• 입사일, 처우 협의 등은 3단계 전형 이후 진행하며, 가능한 지원자님의 상황을 배려해 드리고 있어요.', '• 지원 포지션이나 기타 상황에 따라 진행 순서 및 절차가 변경되거나 사전 테스트가 추가로 진행될 수 있어요.', '', '', '【이렇게 일하게 되실 거예요!】', '', '• 근무 형태: 경력 3년 미만 (6개월), 경력 3년 이상 (3개월)의 수습 기간, 이후 수습 종료 내부 기준에 따라 정규직으로 채용됩니다.', '* 수습 기간은 지원자님과 회사가 서로를 알아가는 소중한 기간이에요. 수습 기간에도 급여 100% 지급 및 동일한 복지가 적용돼요.', '', '', '【서류전형에 대한 채용담당자의 한마디】', '', '패스오더에 관심을 갖고 지원해 주신 모든 분의 서류를 정말 감사한 마음으로 꼼꼼하게 읽어보고 있어요. 그래서 때로는 서류전형에서 일주일 이상의 기간이 소요되기도 해요. 서로가 함께하기 위해 가장 중요한 첫걸음이다 보니 더욱 신중해질 수밖에 없는 패스오더 채용팀이랍니다! 채용의 모든 전형에서 가능한 빠른 피드백을 드리고자 노력할게요!']",,부산광역시 부산진구 서면로 39 KT&G 상상마당
160144,Product Owner,카사코리아(Kasa),"['서울', '한국']","['연봉업계평균이상', '인원급성장', '51~300명', '설립4~9년', '위워크', '핀테크', 'IT, 컨텐츠']","['• 관련 경력 3년 이상자', '• Cross-functional 조직에서 Product Owner 역할 수행 경험', '• Short-term Sprint 기반의 Agile 환경에서 Product Iteration 실무 경험 ', '• MVP 모델을 정의하고 A/B Test로 Product를 런칭한 경험', '• 간결하고 명료한 Verbal/Written Communication 스킬']","['• 앱 서비스 Product Owner 경험', '• 기술 제품의 디자인, 엔지니어링, 또는 Product Owner 경력  ', '• 애자일 조직에 대한 경험이 있는 분', '• 금융 산업에 대한 이해가 높은 분']","['• 뛰어난 팀 동료와의 협업을 통한 지속적인 성장', '• 스스로 책임감을 갖고 업무 할 수 있는 업무환경', '• 시차출퇴근제 운영', '• 매년 6일의 Refresh 휴가', '• 500만원 상당의 IT 기기 제공', '• 식사비용 월 20만원 비과세 지급', '• 23시 이후 퇴근 시 귀가지원비', '• 조직별 운영지원비 지원', '• 업무에 필요한 컨퍼런스/세미나/교육 무제한 지원', '• 종합검진 지원 (30만원/년)', '• 편리한 출퇴근 (선릉역 도보 8분)', '• 쾌적한 환경의 위워크에서 근무']",,"서울특별시 강남구 테헤란로 302, 위워크 선릉점 16층"
137607,[H2OKOREA] 솔루션개발본부_백엔드 개발자,에이치투오호스피탈리티,"['서울', '한국']","['연봉업계평균이상', '인원급성장', '50명이하', '설립4~9년', '육아휴직', '출산휴가', '숙박, 음식점']","['• java, spring, mysql(maria) 등 개발 가능']","['• 컴퓨터공학과 출신 우대', '• 숙박, 액티비티 CMS, PMS 개발 및 프로젝트 경험', '• 퍼블릭 클라우드(AWS)기반 서버리스 환경에서 플랫폼 개발/운영 경험', '• B2B기반 플랫폼 연동 프로젝트 경험']","['• 웰컴키트 제공', '• 자유로운 복장', '• 영어 이름 사용', '• 경조사 지원', '• 명절선물', '• 카페 라운지 이용', '• 청년내일채움 공제', '• 자유로운 연차 사용', '• 출산 휴가, 선물지원 / 육아휴직']","['VueJS', 'CSS', 'HTML', 'JavaScript', 'React.js']","서울특별시 강남구 논현로98길 28, 2층(역삼동)"
157908,Flutter 앱개발자,인졀미,"['서울', '한국']","['퇴사율5%이하', '50명이하', '설립3년이하', '음료', '간식', '인공지능', 'IT, 컨텐츠']","['• flutter 경력 1년 이상', '• git, gitflow 에 익숙하신 분']","['• Android(Kotlin/Java) 개발 경험이 있는 분', '• iOS(Swift4+) 개발 경험이 있는 분', '• 앱 서비스 출시에 참여 경험이 있는 분', '• 업무에 Firebase Analytics / Performance / Crashlytics 를 적용해 본 분', '• 노션을 사용해본 분', '• 스크럼 프로세스 경험이 있는 분']","['• 간식 및 음료 무제한 제공', '• 자유로운 연차 사용']","['Git', 'Android', 'ExpressJS', 'iOS', 'TypeScript', 'Scrum', 'Agile', 'AWS', 'NodeJS', 'Android Studio', 'IntelliJ IDEA', 'Visual Studio Code', 'Flutter', 'Notion']",서초구 태봉로 114 한국교총 8층 801호
142169,System SW Technical Lead,보스반도체,"['경기', '한국']","['석식제공', '커피', '간식', '전문, 과학기술']","['• System 부팅 시간 튜닝 및 최적화   ', '• 리눅스 커널/Android 시스템/RTOS (QNX) 환경에서 드라이버 개발, 디버깅 및 최적화 경험', '  - ARM 기반 SOC architecture 이해 (CPU/bus/interrupt/memory/peripherals/booting)', '  - 전반적인 시스템 부팅 Flow 이해 (A/B booting & secure booting 포함)', '  - Power management framework (sleep/suspend/resume) 이해 ', '  - Device tree 기반 시스템 configuration', '• 코드 리뷰, Git, Github, Gerrit, 및 이슈 관리 시스템 JIRA 활용 경험']","['- 컴퓨터 공학 또는 유사 전공 Ph.D/MS', '- Hypervisor 가상화 플랫폼 개발 및 Multi-VM OS 플랫폼 Integration 경험', '- 차량용 Digital cockpit, Infotainment, 또는 Android Automotive 경험', '- ASPICE 및 functional safety 기반 시스템 설계/개발 경험']","['** 세계최고 SOC 설계 / 검증 및 S/W 전문가와 함께 일하며 본인의 기술 역량을 높일 수 있는 기회**', '', '- 유연한 출퇴근 시간', '- 능력별 Stock Option 부여', '- 조식, 중식, 석식 제공', '- 간식 / 커피 무제한 제공', '- 최적의개발환경제공(듀얼 모니터/HPC서버)', '- 허리건강을위한모션데스크지원', '- On-site 외국어 학습지원', '- 기술도서 구매지원']","['Linux', 'Java', 'Python', 'C++', '검증', 'SoC', 'ASIC', 'RTL 설계']",경기도 성남시 분당구 판교로 255번길 35 실리콘파크 3층
139507,안드로이드 어플 개발자,코콤,"['서울', '한국']","['자기계발', 'IT, 컨텐츠']","['• 어플 개발 실무 경력 4년 이상', '• JAVA 언어로 개발', '• Modular Architecthre에 대한 이해']",['• 관련 자격증 우대'],"['• 자녀학자금 지원 / 장기근속 포상 / 우수사원 포상 / 교육비 지원 / 기념일 선물 / 성과급 ', '• 사내식당, 사택제공, 휴게실, 수면실, 동회회 운영, 통근버스, 휴양시설 지원', '• 자유로운 연차휴가와 위라벨 보장']","['React', 'HTML', 'JavaScript']",서울특별시 강서구 마곡중앙8로 5길 16
82512,Backend(Senior) 개발자,드림어스컴퍼니,"['서울', '한국']","['인원급성장', '301~1,000명', '설립10년이상', '대출지원', '건강검진', '통신비', '재택근무', '연봉상위11~20%', 'IT, 컨텐츠']","['• 총 개발 경력 5년 이상인 분', '• Java Spring framework에 능숙하신 분', '• Java Web Service Back-end 개발 및 운영 경험이 있는 분', '• DBMS/SQL/ORM 에 대한 이해가 있는 분']","['• Golang, Python, Kotlin, Rust 등 다양한 언어를 다양한 언어의 특성을 이해하고 효과적으로 사용한 경험이 있는 분', '• Linux 시스템에 대한 이해를 바탕으로 한 업무 경험이 있는 분', '• 디자인 패턴에 대한 이해를 바탕으로 한 업무 경험이 있는 분', '• 서버 개발 및 운영(DevOps) 경험이 있는 분', '• MSA 개발 환경에 대한 이해를 바탕으로 한 업무 경험이 있는 분', '• MongoDB/Hive 등 NoSQL 운용 경험이 있는 분', '• Redis/MQ/Apache Zookeeper 경험이 있는 분']","['[Work l 드림어스는 개인의 자율성을 존중합니다]', '• 선택적 근로시간제에 따라 2주 80시간, 스스로 업무시간을 조정해요.', '• 하이브리드 근무방식에 따라 사무실 근무와 재택 근무를 유연하게 활용할 수 있어요. (직무 특성에 따라 유연 적용)', '• 더드림(The Dream) 휴가 : 입사연도부터 매년, 기본 제공 연차에 보태어 휴가를 더 드리는 제도예요. 기본 제공 연차+최대 5일의 휴가를 더 쓸 수 있어요.', '', '[Benefit l 드림어스는 아낌없이 지원합니다]', '• 매년 100만원 Dream 포인트를(공연/음반/문화/여행/도서/체력단련) 지급', '• 사내 주택자금 저금리 대출 지원', '• 매월 SKT 통신비 4만원 지원', '• 사내 온라인 강의 및 직무 연계 오프라인 강의/세미나 참석 지원', '• 연장근로 식대/교통비 지원', '• 장기근속 휴가 및 축하금 지원', '• 업무 역량부터 자기 개발까지 도서 지원', '• 최신 기술 활용에 적극 투자 (개발직군은 2년마다, 비개발직군은 3년마다 PC 교체)', '', '[Family&Life l 가족과 개인의 삶도 존중합니다]', '• 명절(설, 추석) 전날에는 반일 근무만 하고 가족들 만나러 가요.', '• 결혼 휴가 2주 및 각종 경조사 휴가, 축하/위로금 지급', '• 연 1회 20만원 상당 본인 및 가족 구성원 1인까지 종합 건강검진 지원', '• 본인 및 배우자, 자녀 대상 단체상해보험 지원 (전액 지원)', '• 휴양 콘도 할인 혜택 제공', '', '[Culture l 더 나은 일하는 문화를 만듭니다]', '• 월 1회 드림어스의 현재를 투명하게 공유할 수 있는 올핸즈 미팅을 진행해요.', '• 분기별 1회 팀원들과 함께 오피스를 벗어나 자유롭게 시간을 보내는 캔 미팅을 진행해요.', '• 서로를 영어 닉네임으로 부르면서 수평적인 커뮤니케이션을 해요.', '', '[꼭 확인해 주세요!]', '• 아래 내용을 포함한 자유양식의 이력서를 제출해주세요. 포트폴리오도 함께라면 더욱 좋습니다.', '', '※ 이력서 필수 기재 사항 :', '이름, 연락처, 이메일, 학력, 경력(회사명/부서/직책/근무기간/담당업무), 상세 경력 기술(진행기간/주요 업무 내용/본인이 기여한 기술력/성과 등)', '', '[참고사항]', '• 본 공고는 모집 완료 시 조기 마감될 수 있습니다.', '• 입사 후 3개월간 수습기간이 적용됩니다.', '• 국가유공자 및 장애인 등 취업보호대상자는 관계 법령에 따라 우대합니다.']","['Git', 'JIRA', 'React', 'CSS', 'HTML', 'JavaScript', 'TypeScript', 'Figma', 'Next.js', 'Vue.JS']",서초구 강남대로 311 드림플러스 강남 15층
123073,[인터파크_엔터주문개발팀] Back-End 개발자,인터파크,"['서울', '한국']","['연봉상위1%', '인원급성장', '1,001~10,000명', '설립10년이상', '상여금', '간식', '사내카페', '원격근무', 'IT, 컨텐츠']","['• JAVA Spring Framewrok / Spring Boot, JPA / iBatis / MyBatis 이용한 Rest API 경험이 있으신 분 (실무 개발 경험이 5년 이상 있으신 분)', '  → 해당 자격 요건이 기본으로 충족되어야 서류전형 검토하오니 자격요건 필히 정독 부탁드립니다.', '• RDBMS(MS-SQL)를 이용한 운영 및 개발 경험이 있으신 분 (실무 개발 경험이 5년 이상 있으신 분)', '• 결제 PG 연동 혹은 제휴 포인트 연동 개발 경험이 있으신 분', '• 새로운 업무와 기술 스택을 익히는데 거부감이 없으신 분', '• 자기 주도적이고 커뮤니케이션이 적극적이신 분']","['• Spring Framework, Spring Boot 기반 웹서비스 개발 경험이 있으신 분 (실무 개발 경험이 5년 이상 있으신 분)', '• Java기반의 Restful API 설계/개발 및 운영이 가능하신 분 (실무 개발 경험이 5년 이상 있으신 분)', '• ASP.NET MVC, Javascript, MS-SQL을 활용하여 설계 및 실무 개발이 가능하신 분', '• ASP.NET 기반 웹서비스 실무 개발 경험이 있으신 분', '• Amazon Web Services 클라우드 플랫폼에서 다양한 서비스 환경을 구축, 경험해보신 분', '• 대용량 트래픽, 데이터를 경험하여 튜닝활동을 해보신 분']","['[전형 및 절차 안내]', '', '서류전형 → 코딩 테스트 → 1차 면접 → 2차 면접 → 처우협의→ 입사', '※ 포지션에 따라 전형이 다르게 운영될 수 있으며, 일정 및 상황에 따라 변동될 수 있습니다.', ' ', '[기타 사항]', '', '• 포지션에 따라 평판조회 전형이 추가될 수 있습니다.', '• 지원서 내용 중 허위사실이 발견될 경우 채용이 취소될 수 있습니다.', '• 국가유공자 예우 및 지원에 관한 법률에 의거 취업 보호 대상자 및 장애인은 관련 법규에 따라 우대합니다.', '• 채용 절차 진행 시 구직자에게 수령한 서류는 구직자의 채용 여부 확정일 이후 180일 동안 보관하고 이후 파기합니다.', ' ', '[복리후생]', '', '1. Life', '• 자율출근제 운영 (출퇴근 시간을 체크하지 않아요!)', '• 원격 근무제 운영', '', '2. Refresh', '• 슈가 데이 (월 1회 2시간 조기 퇴근)', '• 생일 휴가 (생일 반차 & 축하금 5만 원 지급)', '', '3. Gift', '• 100만 원 상당의 복지 포인트 지급', '• 사내 카페테리아 지원', '• 명절 상여금 지급', '• 매달 간식비 지원', '', '4. Health', '• 프리미엄 건강검진 지원', '• 질병, 상해 발생 시 의료비 지원', '• 마음건강을 위한 사내 심리 상담 지원', '', '5. Growth', '• 사내 동호회/스터디 : 활동비 지원', '• 직무 관련 컨퍼런스 및 외부 교육 참여 지원', '', '6. Family', '• 직계가족 실손보험 가입', '• 경조사비 지급 및 경조휴가', '• 연차 외 5일 육아 돌봄 휴가', '• 보육비 지원', '• 법인 콘도 지원']","['Python', '보안', '인프라', 'AWS']",서울특별시 강남구 삼성로 512 삼성동빌딩
78387,시스템 운영 - DB설계 및 운영자,하이디어솔루션즈,"['서울', '한국']","['퇴사율5%이하', '50명이하', '설립10년이상', '육아휴직', '주차', '휴게실', '건강검진', '교육비', '제조']",['• IoT 플랫폼 (DB) 설계 개발 운영 3년이상'],"['• 전공 : 전산/컴퓨터공학 관련', '• IoT/헬스케어/빅데이터 플랫폼 경험', '• B2C 서비스 운영 경험', '• 클라우드 (NCP, AWS) 구축 및 운영']","['• 자유로운 연차 ', '• 퇴직금', '• 각종 경조금 지원', '• 자녀 학자금 지원', '• 장기근속자 포상', '• 교육비 지원', '• 4대보험', '• 야근수당', '• 저녁식대', '• 휴게실', '• 육아휴직', '• 주차장']","['Android', 'iOS', 'UX']",서울시 성동구 아차산로 3 두앤캔빌딩 4층
147952,데이터 개발,중앙일보,"['서울', '한국']","['연봉상위1%', '인원성장', '퇴사율5%이하', '301~1,000명', '설립10년이상', '의료비', 'IT, 컨텐츠']","['• 머신러닝, 딥러닝 등의 데이터 기반 추천 서비스 및 프로젝트를 경험한 분', '• BigQuery, Hadoop, Elastic 등 대용량 데이터 처리 경험이 있는 분', '• Python 등 개발 프로젝트 경험 및 프로그래밍 지식을 보유한 분']","['• GCP, AWS 등 클라우드 플랫폼 경험을 보유한 분', '• Tableau, Data Studio 등 데이터 시각화 툴 경험을 보유한 분', '• Google Analytics, GTM 프로젝트 운영을 경험한 분', '• 실시간 데이터 파이프라인 설계, 구축 및 운영을 경험한 분']","['• 의료비 보장보험 및 종합검진비용 지원', '• 그룹사(중앙일보/JTBC/메가박스/휘닉스호텔앤드리조트) 사용 가능 포인트 제공', '• 메가박스/휘닉스호텔앤드리조트 이용 시 임직원가 할인', '• 경조사 지원', '• 회사 제휴 휴양/레저시설 이용', '• 주택자금 및 생활자금 대출', '• 장기근속휴가 등']",,서울특별시 마포구 상암산로 48-6 중앙일보 빌딩
127278,컴퓨터비전 엔지니어,쉬모스랩,"['서울', '한국']","['인원급성장', '50명이하', '설립4~9년', '유연근무', '스타트업', '와인', '인공지능', 'IT, 컨텐츠']","['# 이런 분과 함께하고 싶어요', '- 이공계(전공 무관) 학사 이상이신 분', '- 머신러닝, 딥러닝에 대한 흥미가 있는 분', '- 컴퓨터비전 및 딥러닝에 대한 지식, 논문을 읽고 구현할 수 있는 능력이 있는 분', '- 처음 해보는 일도 당황하지 않고 침착하게 해결할 수 있는 문제해결 능력이 있는 분', '- 리눅스 개발 환경과 Git, Docker 등 기본적인 개발 도구 사용이 익숙한 분', '- 각종 협업 도구에 익숙하고 새로운 툴을 사용하는데 적극적인 분', '- 새로운 지식에 대한 빠른 습득 능력이 있는 분', '- 사람을 좋아하고 여유를 즐기시는 분']","['# 이런 분을 우대하고 있어요', '- SW 개발 실무 경험이 있는 분', '- Object Detection / Recognition / Segmentation 모델 개발 경험이 있는 분', '- 머신러닝, 딥러닝 관련 프로덕트 개발 경험이 있는 분', '- 모델 Inference 최적화 관련 개발 경험이 있는 분', '- 머신러닝, 딥러닝 관련 대회 참가 경험이 있는 분', '- 머신러닝, 딥러닝 관련 국제학술대회에 논문을 게재한 경험이 있는 분', '- 관련 분야 석사학위 이상을 소지하신 분']","['* 채용 후 3개월의 수습기간이 있으며, 수습기간에도 급여는 100% 지급됩니다.', '* 유연근무제를 시행하고 있습니다.']","['Linux', 'C / C++', 'Python', 'SQL', 'AWS', 'Docker']",서울 강남구 논현로26길 21
